{
  "issuer": "https://adfs.hku.hk/adfs",
  "authorization_endpoint": "https://adfs.hku.hk/adfs/oauth2/authorize/",
  "token_endpoint": "https://adfs.hku.hk/adfs/oauth2/token/",
  "jwks_uri": "https://adfs.hku.hk/adfs/discovery/keys",
  "token_endpoint_auth_methods_supported": [
    "client_secret_post",
    "client_secret_basic",
    "private_key_jwt",
    "windows_client_authentication"
  ],
  "response_types_supported": [
    "code",
    "id_token",
    "code id_token",
    "id_token token",
    "code token",
    "code id_token token"
  ],
  "response_modes_supported": [
    "query",
    "fragment",
    "form_post"
  ],
  "grant_types_supported": [
    "authorization_code",
    "refresh_token",
    "client_credentials",
    "urn:ietf:params:oauth:grant-type:jwt-bearer",
    "implicit",
    "password",
    "srv_challenge",
    "urn:ietf:params:oauth:grant-type:device_code",
    "device_code"
  ],
  "subject_types_supported": [
    "pairwise"
  ],
  "scopes_supported": [
    "user_impersonation",
    "email",
    "winhello_cert",
    "logon_cert",
    "aza",
    "profile",
    "vpn_cert",
    "openid",
    "allatclaims"
  ],
  "id_token_signing_alg_values_supported": [
    "RS256"
  ],
  "token_endpoint_auth_signing_alg_values_supported": [
    "RS256"
  ],
  "access_token_issuer": "http://adfs.hku.hk/adfs/services/trust",
  "claims_supported": [
    "aud",
    "iss",
    "iat",
    "exp",
    "auth_time",
    "nonce",
    "at_hash",
    "c_hash",
    "sub",
    "upn",
    "unique_name",
    "pwd_url",
    "pwd_exp",
    "mfa_auth_time",
    "sid",
    "nbf"
  ],
  "microsoft_multi_refresh_token": true,
  "userinfo_endpoint": "https://adfs.hku.hk/adfs/userinfo",
  "capabilities": [
    "kdf_ver2"
  ],
  "end_session_endpoint": "https://adfs.hku.hk/adfs/oauth2/logout",
  "as_access_token_token_binding_supported": true,
  "as_refresh_token_token_binding_supported": true,
  "resource_access_token_token_binding_supported": true,
  "op_id_token_token_binding_supported": true,
  "rp_id_token_token_binding_supported": true,
  "frontchannel_logout_supported": true,
  "frontchannel_logout_session_supported": true,
  "device_authorization_endpoint": "https://adfs.hku.hk/adfs/oauth2/devicecode"
}
